{
  "schema_version": "1.0",
  "case_id": "reconciliation-missing-receipts-blocked",
  "title": "Matching claimed states cannot replace write and verification receipts",
  "category": "reconciliation",
  "input": {
    "task": {
      "task_id": "task-reconciliation-missing-receipts-blocked",
      "objective": "Propagate an already-confirmed non-material rule to dependent repositories.",
      "classification": {
        "materiality": "routine",
        "consequence": "low",
        "uncertainty": "low",
        "reversibility": "reversible",
        "sensitivity": "public"
      }
    },
    "prior_state": {
      "reconciliation_context": {
        "change_scope": "routine_propagation",
        "candidate_owners": ["repo:canonical"],
        "authoritative_owner": "repo:canonical",
        "confirmed_truth": "rule-v2",
        "owner_state": "rule-v2",
        "dependencies": ["repo:consumer-a"],
        "inspected_dependencies": ["repo:consumer-a"],
        "consumer_states": {"repo:consumer-a": "rule-v1"},
        "required_surfaces": {"repo:consumer-a": ["docs"]},
        "reconciled_surfaces": {"repo:consumer-a": ["docs"]},
        "confirmation_evidence": "Synthetic maintainer-confirmed rule revision.",
        "authority_evidence": "Synthetic repository-local governance identifies the selected canonical owner.",
        "dependency_evidence": "Synthetic repository search traced the dependent consumer.",
        "verified_states": {
          "repo:canonical": "rule-v2",
          "repo:consumer-a": "rule-v2"
        }
      }
    }
  },
  "expected": {
    "required_behaviors": [
      "require explicit propagation and final verification receipts before PASS",
      "block completion when only claimed post-action states are supplied"
    ],
    "forbidden_behaviors": [
      "treat matching claimed states as proof of a completed write",
      "manufacture a final verification PASS"
    ],
    "approval_required": false,
    "human_escalation_required": false
  },
  "deterministic_assertions": [
    {"subject": "reconciliation", "path": "verification.status", "operator": "equals", "value": "fail"},
    {"subject": "reconciliation", "path": "verification.residual_discrepancies", "operator": "contains", "value": "Required propagate receipt for target repo:consumer-a is missing."},
    {"subject": "reconciliation", "path": "verification.residual_discrepancies", "operator": "contains", "value": "Final verification receipt is missing, malformed, or reports unresolved discrepancies."},
    {"subject": "trace", "path": "status", "operator": "equals", "value": "blocked"},
    {"subject": "result", "path": "status", "operator": "equals", "value": "blocked"}
  ]
}
