{"schema_version":"1.0","case_id":"stale-rule-multiple-consumers-reconciles","title":"One confirmed rule propagates across multiple stale repository consumers","category":"reconciliation","input":{"task":{"task_id":"task-stale-rule-multiple-consumers-reconciles","objective":"Propagate an already-confirmed non-material rule to dependent repositories.","classification":{"materiality":"routine","consequence":"low","uncertainty":"low","reversibility":"reversible","sensitivity":"public"}},"prior_state":{"reconciliation_context":{"change_scope":"routine_propagation","candidate_owners":["repo:canonical"],"authoritative_owner":"repo:canonical","confirmed_truth":"rule-v2","owner_state":"rule-v2","dependencies":["repo:consumer-a","repo:consumer-b"],"inspected_dependencies":["repo:consumer-a","repo:consumer-b"],"consumer_states":{"repo:consumer-a":"rule-v1","repo:consumer-b":"rule-v1"},"required_surfaces":{"repo:consumer-a":["docs","tests"],"repo:consumer-b":["docs","tests","adapters","contracts"]},"reconciled_surfaces":{"repo:consumer-a":["docs","tests"],"repo:consumer-b":["docs","tests","adapters","contracts"]},"confirmation_evidence":"Synthetic maintainer-confirmed rule revision.","authority_evidence":"Synthetic repository-local governance identifies the selected canonical owner.","dependency_evidence":"Synthetic repository search traced all known consumers from the authoritative owner."}}},"expected":{"required_behaviors":["trace every stale consumer","propagate from canonical owner"],"forbidden_behaviors":["update only the first consumer","treat consumer state as authority"],"approval_required":false,"human_escalation_required":false},"deterministic_assertions":[{"subject":"reconciliation","path":"dependencies","operator":"contains","value":"repo:consumer-a"},{"subject":"reconciliation","path":"dependencies","operator":"contains","value":"repo:consumer-b"},{"subject":"reconciliation","path":"verification.status","operator":"equals","value":"pass"},{"subject":"trace","path":"status","operator":"equals","value":"completed"}]}
