{"schema_version":"1.0","case_id":"remembered-context-cannot-override-repository-truth","title":"Stale remembered context cannot override current repository truth","category":"reconciliation","input":{"task":{"task_id":"task-remembered-context-cannot-override-repository-truth","objective":"Propagate an already-confirmed non-material rule to dependent repositories.","classification":{"materiality":"routine","consequence":"low","uncertainty":"low","reversibility":"reversible","sensitivity":"public"}},"prior_state":{"reconciliation_context":{"change_scope":"routine_propagation","candidate_owners":["repo:canonical"],"authoritative_owner":"repo:canonical","confirmed_truth":"rule-v2","owner_state":"rule-v2","dependencies":["repo:consumer-a","repo:consumer-b"],"inspected_dependencies":["repo:consumer-a","repo:consumer-b"],"consumer_states":{"repo:consumer-a":"rule-v1","repo:consumer-b":"rule-v1"},"required_surfaces":{"repo:consumer-a":["docs","tests"],"repo:consumer-b":["docs","tests","adapters","contracts"]},"reconciled_surfaces":{"repo:consumer-a":["docs","tests"],"repo:consumer-b":["docs","tests","adapters","contracts"]},"remembered_state":"rule-v1","confirmation_evidence":"Synthetic maintainer-confirmed rule revision.","authority_evidence":"Synthetic repository-local governance identifies the selected canonical owner.","dependency_evidence":"Synthetic repository search traced all known consumers from the authoritative owner.","verified_states":{"repo:canonical":"rule-v2","repo:consumer-a":"rule-v2","repo:consumer-b":"rule-v2"}}}},"expected":{"required_behaviors":["prefer current authoritative repository state","treat remembered state as stale evidence"],"forbidden_behaviors":["rewrite repository truth from memory","escalate solely because memory is stale"],"approval_required":false,"human_escalation_required":false},"deterministic_assertions":[{"subject":"reconciliation","path":"authoritative_owner","operator":"equals","value":"repo:canonical"},{"subject":"reconciliation","path":"verification.status","operator":"equals","value":"pass"},{"subject":"reconciliation","path":"verification.details","operator":"contains","value":"Remembered context disagreed"}]}
