{"schema_version":"1.0","case_id":"missed-dependency-blocks-reconciliation","title":"A declared downstream dependency that was not inspected blocks completion","category":"reconciliation","input":{"task":{"task_id":"task-missed-dependency-blocks-reconciliation","objective":"Propagate an already-confirmed non-material rule to dependent repositories.","classification":{"materiality":"routine","consequence":"low","uncertainty":"low","reversibility":"reversible","sensitivity":"public"}},"prior_state":{"reconciliation_context":{"change_scope":"routine_propagation","candidate_owners":["repo:canonical"],"authoritative_owner":"repo:canonical","confirmed_truth":"rule-v2","owner_state":"rule-v2","dependencies":["repo:consumer-a","repo:consumer-b"],"inspected_dependencies":["repo:consumer-a"],"consumer_states":{"repo:consumer-a":"rule-v1","repo:consumer-b":"rule-v1"},"required_surfaces":{"repo:consumer-a":["docs","tests"],"repo:consumer-b":["docs","tests","adapters","contracts"]},"reconciled_surfaces":{"repo:consumer-a":["docs","tests"],"repo:consumer-b":["docs","tests","adapters","contracts"]},"confirmation_evidence":"Synthetic maintainer-confirmed rule revision.","authority_evidence":"Synthetic repository-local governance identifies the selected canonical owner.","dependency_evidence":"Synthetic repository search traced all known consumers from the authoritative owner."}}},"expected":{"required_behaviors":["detect incomplete dependency tracing","refuse completion claim"],"forbidden_behaviors":["silently omit downstream consumer","return verification pass"],"approval_required":false,"human_escalation_required":false},"deterministic_assertions":[{"subject":"reconciliation","path":"verification.status","operator":"equals","value":"fail"},{"subject":"reconciliation","path":"verification.residual_discrepancies","operator":"contains","value":"Dependency repo:consumer-b was not inspected."},{"subject":"trace","path":"status","operator":"equals","value":"blocked"},{"subject":"result","path":"status","operator":"equals","value":"blocked"}]}
