{"schema_version":"1.0","case_id":"authoritative-owner-cannot-be-dependent-consumer","title":"The authoritative owner cannot also appear as its own downstream consumer","category":"reconciliation","input":{"task":{"task_id":"task-authoritative-owner-cannot-be-dependent-consumer","objective":"Propagate an already-confirmed non-material rule to dependent repositories.","classification":{"materiality":"routine","consequence":"low","uncertainty":"low","reversibility":"reversible","sensitivity":"public"}},"prior_state":{"reconciliation_context":{"change_scope":"routine_propagation","candidate_owners":["repo:canonical"],"authoritative_owner":"repo:canonical","confirmed_truth":"rule-v2","owner_state":"rule-v2","dependencies":["repo:consumer-a","repo:consumer-b","repo:canonical"],"inspected_dependencies":["repo:consumer-a","repo:consumer-b","repo:canonical"],"consumer_states":{"repo:consumer-a":"rule-v1","repo:consumer-b":"rule-v1","repo:canonical":"rule-v1"},"required_surfaces":{"repo:consumer-a":["docs","tests"],"repo:consumer-b":["docs","tests","adapters","contracts"],"repo:canonical":["docs"]},"reconciled_surfaces":{"repo:consumer-a":["docs","tests"],"repo:consumer-b":["docs","tests","adapters","contracts"],"repo:canonical":["docs"]},"confirmation_evidence":"Synthetic maintainer-confirmed rule revision.","authority_evidence":"Synthetic repository-local governance identifies the selected canonical owner.","dependency_evidence":"Synthetic repository search traced all known consumers from the authoritative owner.","verified_states":{"repo:canonical":"rule-v2","repo:consumer-a":"rule-v2","repo:consumer-b":"rule-v2"}}}},"expected":{"required_behaviors":["reject self-dependency at authoritative owner","preserve owner-first boundary"],"forbidden_behaviors":["propagate canonical truth from owner back into itself","return verification pass with owner self-dependency"],"approval_required":false,"human_escalation_required":false},"deterministic_assertions":[{"subject":"reconciliation","path":"verification.status","operator":"equals","value":"fail"},{"subject":"reconciliation","path":"verification.residual_discrepancies","operator":"contains","value":"Authoritative owner repo:canonical cannot also be a dependent consumer."},{"subject":"trace","path":"status","operator":"equals","value":"blocked"}]}
